IPMC |  All Questions ,,,,,,,,,,,,,,,,,,,,
No.,Questions,Answer A,Answer B,Answer C,Answer Correct,Feedback,Questions Ar,Answer A Ar,Answer B Ar,Answer C Ar,Answer Correct Ar,Feedback Ar,Chapter,Process Group,Free Quiz,Exam No.,Column1,,,
1,"You have been appointed as a project manager for a new project. After several months, you find that the accounting department has reject all charges because the project was not approved. What should the project manager have done to prevent this? ",Obtained the fund needed to start the project,Planned the resources necessary to start the project ,Verified that the business case was authorized by the project initiator ,Get the project charter approval from the project sponsor,"The sponsor or initiator of the project Is responsible to establish (approve and issue) the charter and can take the help of the prospect project manager to develop it. The project manager should obtain the project charter approval from the project sponsor because the project charter is a document that formally authorizes the existence of a project al d provides the project manager with the authority to apply organizational resources to project activities. [PMBOK 6th edition page, 75].","ιη§ Άκ Άγοολθ θκ§ο© κ¬©νγ ικ¬©νγ ¤§ο§.  γ§ γ§΅ ¬μ© ? Ά¤§ λ η«κ ικ¥« ΅ η§ ©εΰ ¤κογ ικαι Ά ικιο΅ ιλ ικ¬©νγ ικ ΆΆκ ικνεη΅ γιομ. κ ι¨ο θλ ο¤  γιξ κ§ο© ικ¬©νγ εγιμ ικλγ ¨ιθ?",ι¥­νι γιξ ικνι ιικ΅ ι § ικ¬©νγ,Ά¦αοα ικν©§ ιικ΅ ι § ικ¬©νγ ,ιΆ¥ηη κλ γΆκ§ κ«Άλ§ ¥ι΅ γκι ικ¬©νγ κλ η ι  § ικ¬©νγ ,ι¥­νι γιξ κνεη΅ κο£η ικ¬©νγ κλ ©γο ικ¬©νγ,"οθνλ ι©γο ν ι §  ικ¬©νγ κ«›νιρ γλ λ¬ (ικνεη΅ ν­§©) ικο£η νοκθλμ ι«Άγλ΅  κ§ο© ικ¬©νγ ικ¥Άκι ιΆανο©μ. ο¤  λ ο¥­ι κ§ο© ικ¬©νγ γιξ κνεη΅ κο£η ικ¬©νγ κλ ι¤μ΅ ι©γο΅ ιικ¬©νγ ιλ κο£η ικ¬©νγ μν κ«Άλ§ ο­©¥ ©«κορ  ν¤ν§ κ¬©νγ ? νμν κ οκλ¥ κ§ο© ικ¬©νγ ι«ια΅ ιΆα οη ικν©§ ιΆλβοκο΅ γιξ λ¬α΅ ικ¬©νγ. [PMBOK ια γ΅ ι«§«΅ ? ι­ε¥΅ 75]",140,2,False,"""17""",Ahmad,,,
2,A project progressing on time and within budget is 40 days away from achieving its main milestone. The project manager then learns that a key component to achieve this milestone will be unavailable for 60 days. What should the project manager do? ,Send an amended progress report to all stakeholders.,Notify stakeholders at the next project status meeting. ,Revise the risk management plan.,Update the issue log. ,"Because ( milestone will be unavailable for 60 days.) This Is an example of an issue and should be documented In the issue log. The Issue log will help the project manager effectively track and manage Issues, ensuring that they are investigated and resolved. [PMBOK 6th edition Page, 96]",οΆη§κ ικ¬©νγ εο ινηΆ ικ¥§§ νεο ¥§ν§ ικολο΅ γιξ  γ§ 40 ονκρ κλ Ά¥ηοη ¥§ ι¥§£ ι©ο«ο΅  ικ¬©νγ. ογικ κ§ο© ικ¬©νγ  γ§ ¨ιθ λ ικθνλ ι©ο«ο ιΆ¥ηοη μ¨ ιλ¤ ιλ οθνλ κΆ¥ρ ικ§΅ 60 ονκρ. κ¨ ο¤  λ οεγι κ§ο© ικ¬©νγ?,©«ι Άη©ο© κ©¥ιο κγ§ι ιξ ¤κογ ­¥  ικ­ι¥΅.,¦α© ­¥  ικ­ι¥΅ εο ¤Άκγ ¥ι΅ ικ¬©νγ ιΆιο. ,κ©¤γ΅ ¦α΅ §©΅ ικ¦α©.,ιηοκ  Ά¥§ο£ «¤ι ικ¬θι΅. ," «   (ιλ Άθνλ ικ©¥ι΅ ι©ο«ο΅ κΆ¥΅ ικ§΅ 60 ονκρ.) μ¨ κ£ι γιξ κ¬θι΅ νο¤  Άν£οημ εο «¤ι ι¥§£. «ο«γ§ «¤ι ι¥§£ κ§ο© ικ¬©νγ γιξ ΆΆ γ ικ¬θιΆ ν§©Άμ  ¬θι εγι ? κκ οΰκλ ιΆ¥ηοη εομ ν¥ιμ. [PMBOK ια γ΅ ι«§«΅ ? ι­ε¥΅ 96]",140,4,False,"""16""",Ahmad,,,
3,"You are a project manager in an Construction project. During the work, an unexpected resource shortage occurs. What should the project manager do? ",Perform a qualitative risk analysis ,Risk categorization ,Risk probability and impact assessment ,Refer to the risk register and inform key stakeholders ,"As an unexpected power outage occurs, the project manager should first Refer to the risk register and inform key stakeholders to handle this scenario. Risk categorization and Risk probability and Impact assessment are Tools & Techniques in Perform a qualitative risk analysis process, therefore they can be excluded. [PMBOK 6th edition Page, 453]","λΆ κ§ο© κ¬©νγ εο κ¬©νγ  λ. £λ ιγκι ? ο¥§£ λη­ δο© κΆνηγ εο ικν©§. κ¨ ο¤  λ οεγι κ§ο© ικ¬©νγ?",ιηοκ  ¤© Ά¥ιοι λνγο ιικ¦α© ,Ά­λοε ικ¦α© ,Άηοοκ ¥Άκιο΅ ικ¦α©  ι£© ,ι©¤νγ ιξ «¤ι ικ¦α© ν ιδ ­¥  ικ­ι¥΅ ι©ο«οολ ,"γλ§ ¥§ν£ ληαγ δο© κΆνηγ ιιΆο© ιθμ© ο ? ο¤  γιξ κ§ο© ικ¬©νγ ι©¤νγ νιρ ιξ «¤ι ικ¦α© ν ιδ ­¥  ικ­ι¥΅ ι©ο«οολ ιιΆγκι κγ μ¨ ι«ολ©ον. Ά­λοε ικ¦α© ν¥Άκιο΅ ικ¦α© νΆηοοκ ι£© μο §νΆ νΆηλοΆ εο ¤© γκιο΅ Ά¥ιοι κ¦α© λνγο΅ ? ν ιΆιο οκθλ «Ά γ§μ. [PMBOK ια γ΅ ι«§«΅ ? ι­ε¥΅ 453]",147,5,False,"""20""",Ahmad,,,
4,The customer wants to remove certain characteristics from the product. The project manager submits a change request which is approved by the change control board (CCB). What should the project manager do next? ,Update the risk register. ,Update the project charter.,Update the issue log. ,Update the project management plan. ,"The project management plan should be updated after a change request takes approval by CCB. [PMBOK 6th edition Page, 120]",ο©ο§ ιγκοι ι΅ ¦­­ κγολ΅ κλ ικλΆ¤. οη§κ κ§ο© ικ¬©νγ αι  ιΆδοο© ι¨ο ΆκΆ ικνεη΅ γιομ κλ η ι ι¤λ΅ ιΆ¥θκ εο ιΆδοο© (CCB). κ¨ ο¤  λ οεγι κ§ο© ικ¬©νγ  γ§ ¨ιθ?,Ά¥§ο£ «¤ι ικ¦α©. ,Ά¥§ο£ κο£η ικ¬©νγ.,ηκ  Ά¥§ο£ «¤ι ικ¬θι΅. ,Ά¥§ο£ ¦α΅ §©΅ ικ¬©νγ. ,"ο¤  Ά¥§ο£ ¦α΅ §©΅ ικ¬©νγ  γ§ λ ο¦¨ αι  ιΆδοο© κνεη΅ ι¤λ΅ ιΆ¥θκ εο ιΆδοο©. [PMBOK ια γ΅ ι«§«΅ ? ι­ε¥΅ 120]",140,5,False,"""16""",Ahmad,,,
5,"A project manager wants to recruit another team member to replace an engineer who retired. What document should capture this change? 
 
  
",Ground rules ,Organizational process Assets.,Project management plan.,Responsibility assignments matrix (RAM),"Responsibility assignments matrix RAMS are used within the group to designate roles, responsibilities, and levels of authority for specific activities. The matrix format shows all activities associated with one person and alt people associated with one activity. This also ensures that there is only one person accountable for each task to avoid confusion about who is ultimately in charge or has authority for the work. [PMBOK 6th edition Page, 317]","ο©ο§ κ§ο© ικ¬©νγ Άγοολ γΰν ™¦© εο ιε©οη ιο¥ι κ¥ι κμλ§« κΆηγ§. κ μο ιν£οη΅ ιΆο ο¤  λ ΆιΆηα μ¨ ιΆδοο©?
",ιηνγ§ ι««ο΅ ,­νι ιγκιοΆ ιΆλβοκο΅.,¦α΅ §©΅ ικ¬©νγ.,κ­ενε΅ Άγοολ ικ«›νιοΆ (RAM),"κ­ενε΅ Άγοολ ικ«›νιοΆ Άυ«Ά¦§κ  §¦ι ικ¤κνγ΅ ιΆγοολ ι§ν© νικ«›νιοΆ νκ«ΆνοΆ ι«ια΅ ιλ¬α΅ κ¥§§΅. ουβμ© Άλ«οη ικ­ενε΅ ¤κογ ιλ¬α΅ ικ©Ά α΅  ¬¦­ ν¥§ ν¬¦­  §οι κ©Ά αολ  λ¬α ν¥§. οΰκλ μ¨ οΰρ λ οθνλ μλθ ¬¦­ ν¥§ εηα κ«›νι γλ θι κμκ΅ ιΆ¤λ  ιιΆ « ¥νι κλ μν ικ«›νι εο ιλμο΅ ν ι¨ο ι§ομ ι«ια΅ γιξ ιγκι. [PMBOK ια γ΅ ι«§«΅ ? ι­ε¥΅ 317]",145,3,False,"""19""",Ahmad,,,
6,"While creating the probability and impact matrix, what should the project manager and his team consider to support the project risk analysis? ",Project scope and project deliverables.,Project quality and resources.,Contingency reserve for budget and schedule.,Possible effects on the objectives of the project. ,"The most important element that should the team and project manager consider while creating the probability and Impact matrix Is the Possible effects on the objectives of the project by taking the highest priority level regardless of which objective Is affected. [PMBOK 6th edition page, 425]
","£λ λ¬ κ­ενε΅ ι¥ΆκιΆ νιΆ£ο© ? κ ι¨ο ο¤  γιξ κ§ο© ικ¬©νγ νε©οημ ιλβ© εομ ι§γκ Ά¥ιοι κ¦α© ικ¬©νγ? ",λαη ικ¬©νγ νΆ«ιοκΆ ικ¬©νγ.,¤ν§΅ ικ¬©νγ νικν©§.,¥Άοαο ιαν© ιικολο΅ νι¤§νι ικλο.,ιΆ£ο©Ά ικ¥Άκι΅ γιξ μ§ε ικ¬©νγ. ,"μκ γλ­© ο¤  γιξ ιε©οη νκ§ο© ικ¬©νγ κ©γΆμ £λ λ¬ κ­ενε΅ ι¥ΆκιΆ νι£© μν ιΆ£ο©Ά ικ¥Άκι΅ γιξ μ§ε ικ¬©νγ κλ ¦ιι Ά¦¨ γιξ κ«Άνξ κλ ινινο΅  δΰ ιλβ© γλ ιμ§ε ικΆ£©. [PMBOK ια γ΅ ι«§«΅ ? ι­ε¥΅ 425]
",144,3,False,"""16""",Ahmad,,,
7,"You are a project manager in a construction project. The project is ahead of schedule and under budget. A key stakeholder suggests a change to include a value-added feature that wouldn't impact project schedule and cost. What should you do next? 

 ","Advise the stakeholder that, since the project is under budget. the feature will be added",Advise the stakeholder that changes shouldn't be implemented when a project is behind schedule.,Update the project management plan to include the new feature.,Evaluate the change's impact with the project team.,"The change does not Impact the schedule and cost but the project manager should evaluate the change's impact on the other constrains with the project team. [PMBOK 6th edition page, 90]
","λΆ κ§ο© κ¬©νγ εο κ¬©νγ  λ. ικ¬©νγ κΆη§κ  ι¤§νι ικλο νΆ¥Ά ικολο΅ ικ¥§§΅. οηΆ©¥ ¥§ ­¥  ικ­ι¥΅ ι©ο«οολ ¤© Άδοο© ιο¬κι κο΅ ¨Ά ηοκ΅ κΰε΅ ιλ Ά›£© γιξ ¤§νι ικ¬©νγ νΆθιεΆμ. κ¨ ο¤  λ Άεγι  γ§ ¨ιθ?
"," ιδ ­¥  ικ­ι¥΅  λμ ?  κ λ ικ¬©νγ Ά¥Ά ικολο΅. «ΆΆκ ΰε΅ ικο΅",¦ © ­¥  ικ­ι¥΅  λμ ι ολ δο Άλεο¨ ιΆδοο©Ά γλ§κ οΆ¦© ικ¬©νγ γλ ι¤§νι ικλο.,ιηοκ  Ά¥§ο£ ¦α΅ §©΅ ικ¬©νγ ιΆΰκολ ικο΅ ι¤§ο§΅.,ιηοκ  Άηοοκ Ά£ο© ιΆδοο© κγ ε©οη ικ¬©νγ.,"ι ο›£© ιΆδοο© γιξ ι¤§νι ικλο νιΆθιε΅ νιθλ ο¤  γιξ κ§ο© ικ¬©νγ Άηοοκ Ά£ο© ιΆδοο© γιξ ιηον§ ι¦©ξ κγ ε©οη ικ¬©νγ. [PMBOK ια γ΅ ι«§«΅ ? ι­ε¥΅ 90]
",140,4,False,"""17""",Ahmad,,,
8,If the project deliverables didn't meet the agreed-upon acceptance criteria. What should the project manager reference to verity this with the contractor?,Quality log,Request for proposal (RFP).,Procurement management plan,Statement of work (SOW). ,"The SOW Include 1. Description of the procurement item, 2. Specifications, quality requirements and performance metrics, 3. Description of collateral services required, and 4. Acceptance methods and criteria. [PMBOK 6th edition page. 481]
",¨ θλΆ κ¦©¤Ά ικ¬©νγ ι Άι ο κγοο© ιη νι ικΆεη γιομ. κ ι¨ο ο¤  λ ο¬ο© ιομ κ§ο© ικ¬©νγ  ­§η μ¨ κγ ικηνι?,«¤ι ι¤ν§΅,κ«Άλ§ αι  κηΆ©¥ (RFP).,¦α΅ §©΅ ικ¬Ά©οΆ, ολ ιγκι  ικ¬©νγ (SOW). ,"οΆΰκλ  ολ ιγκι 1. ν­ε  λ§ ι¬© ? 2. ικν­εΆ νκΆαι Ά ι¤ν§΅ νκηοο« ι§ ? 3. ν­ε ι¦§κΆ ιΰεο΅ ικαιν ΅ ? ν 4. α©η νκγοο© ιη νι. [PMBOK ια γ΅ ι«§«΅ ? ι­ε¥΅ 481]
",148,3,False,"""18""",Ahmad,,,
9,"In your project, the Schedule Performance Index SPI is 0.7, and Cost Performance Index CPI 1.1. You analyzed the baseline and decided to return the schedule back to meet the baseline. You will: ",Terminate the project.,Check with your sponsor.,Check tasks which can be removed from baseline.,Check options of crashing or fast-tracking the project.,"SPI = 0.7 and CPI = 1.1 mean that the [Project is behind schedule and under budget. In this case, the project manager should Crash the project to meet the baseline. [PMBOK 6th edition page.263]
","εο κ¬©νγθ ? κ›¬© § ι¤§νι ικλο SPI μν 0.7 ? νκ›¬© § ιΆθιε΅ CPI 1.1. ιη§ ηκΆ  Ά¥ιοι ¦α ι«« νη©©Ά ©¤γ ι¤§νι ικλο κ©΅ ¦©ξ ιοΆνεη κγ ¦α ι««. «νε:",λμ ικ¬©νγ.,Ά¥ηη κγ ι©γο ι¦­  θ.,Ά¥ηη κλ ικμκ ιΆο οκθλ ιΆμ κλ ι««.,Ά¥ηη κλ ¦ο©Ά ¥¬§ ικν©§ ν ιΆΆ γ ι«©ογ ιικ¬©νγ.,"SPI = 0.7 ν CPI = 1.1 ογλο λ [ικ¬©νγ κΆ¦© γλ ι¤§νι ικλο νΆ¥Ά ικολο΅ ικ¥§§΅. εο μ¨μ ι¥ι΅ ? ο¤  γιξ κ§ο© ικ¬©νγ ¥¬§ κν©§ ικ¬©νγ ιΆι ο΅ ¦α ι«« ικ©¤γο ικγΆκ§.
 [ια γ΅ ι«§«΅ ? ι­ε¥΅ 263 PMBOK]",142,5,False,"""17""",Ahmad,,,
10,"An experienced engineer is hired to supervise a subcontractor hired for a project. The experienced engineer uses an effective cost control technique, but it is not the agreed-upon technique for the project. This causes conflicts with the integration group reconciling the monthly reports. What should the project manager do? ",Force the new employee to follow the agreed-upon technique.,Initiate a change request to resolve the issue.,Search for solutions that are similar to the existing technique.,Emphasize the advantage of the new method and change the technique with which costs are managed.,"The experienced engineer uses an effective cost control technique, so the project manager should emphasize the advantage of the new method and change the technique with which costs are managed. The option (initiate a change request to resolve the issue) not correct because no need to issue a change request to solve this issue. The option (Search for solutions that are similar to the existing technique) not correct because the experienced engineer uses an effective cost control technique. The option (Force the new employee to follow the agreed upon technique) will Increase the conflict and will not solve the issue.  [PMBOK 6th edition. Page 257]","οΆκ Άγοολ κμλ§« κΆκ©« ιι¬©ε γιξ κηνι κλ ι αλ Άκ Άγοολμ ικ¬©νγ. ο«Ά¦§κ ικμλ§« ικΆκ©« Άηλο΅ εγι΅ ιιΆ¥θκ εο ιΆθιε΅ ? νιθλμ ιο«Ά ιΆηλο΅ ικΆεη γιομ ιικ¬©νγ. οΆ«   μ¨ εο ¥§ν£ Άγ©ΰ κγ κ¤κνγ΅ ιΆθκι ιΆο Άηνκ  Ά«νο΅ ιΆη©ο© ι¬μ©ο΅. κ¨ ο¤  λ οεγι κ§ο© ικ¬©νγ?",¤ © ικνβε ι¤§ο§ γιξ Ά γ ι«ιν  ικΆεη γιομ.,ι § εο αι  ιΆδοο© ι¥ι ικ¬θι΅.,ι ¥£ γλ ¥ινι κ¬ μ΅ ιιΆηλο΅ ι¥ιο΅.,ιΆθο§ γιξ κο΅ ια©οη΅ ι¤§ο§΅ νΆδοο© ιΆηλο΅ ιΆο Ά§©  μ ιΆθιοε.,"ο«Ά¦§κ ικμλ§« ικΆκ©« Άηλο΅ εγι΅ ιιΆ¥θκ εο ιΆθιε΅ ? ι¨ιθ ο¤  γιξ κ§ο© ικ¬©νγ ιΆθο§ γιξ κο΅ ια©οη΅ ι¤§ο§΅ νΆδοο© ιΆηλο΅ ιΆο Ά§©  μ ιΆθιοε. ¦ο© ( § αι  Άδοο© ι¥ι ικ¬θι΅) δο© ­¥ο¥ ιλμ ι §γο ι­§© αι  Άδοο© ι¥ι μ¨μ ικ¬θι΅. ¦ο© (ι ¥£ γλ ¥ινι κ¬ μ΅ ιιΆηλο΅ ι¥ιο΅) δο© ­¥ο¥ ιλ ικμλ§« ικΆκ©« ο«Ά¦§κ Άηλο΅ εγι΅ ιιΆ¥θκ εο ιΆθιε΅. «ο›§ο ¦ο© (¤ © ικνβε ι¤§ο§ γιξ Ά γ ι«ιν  ικΆεη γιομ) ιξ ο§΅ ιΆγ©ΰ νιλ ο¥ι ικ¬θι΅. [PMBOK ια γ΅ ι«§«΅ ? ι­ε¥΅ 257]",143,5,False,"""18""",Ahmad,,,
11,A project manager updating a dashboard monthly with information on the project's performance using project management information system (PMIS). Which of the following communication methods describes this? ,Manual communication,Interactive Communication.,Informal communication.,Pull Communication.,Dashboards help the Internal and external stakeholders to get project information any time. its example of pull communication. [PMBOK 6th edition. Page 374],οηνκ κ§ο© ικ¬©νγ  Ά¥§ο£ ιν¥΅ ιηο§΅ ¬μ©ορ  κγινκΆ γλ § ικ¬©νγ  «Ά¦§κ λβκ κγινκΆ §©΅ ικ¬©νγ (PMIS). ο κλ α©η ιΆ­ι ιΆιο΅ Ά­ε μ¨?,ιΆ­ι ιο§νο,ιΆν­ι ιΆεγιο.,ιΆν­ι δο© ι©«κο.,«¥  ιΆ­ι.,"Ά«γ§ ιν¥Ά ικγινκΆ ­¥  ικ­ι¥΅ ι§¦ιοολ νι¦©¤οολ εο ι¥­νι γιξ κγινκΆ ικ¬©νγ εο ο νηΆ. κ£ιμ γιξ «¥  ιΆ­ι. [PMBOK ια γ΅ ι«§«΅ ? ι­ε¥΅ 374]",146,3,False,"""16""",Ahmad,,,
12,"During project closure and transferring of the completed project deliverables to the operation department, the project manager discovers that an audit report from an early project phase is missing. What should the project manager do? ",Remove the audit report from the required project documents and update the project management plan.,Ask the operation department representative to accept the project without the audit report. ,Complete project closure and update the OPA ,Inform the operation department representative about the missing audit report. ,"Ethically, the project manager must Inform the operation department representative about the missing audit report. [PMBOK 6th edition. Page 121]","£λ διη ικ¬©νγ νληι Ά«ιοκΆ ικ¬©νγ ικθΆκι΅ ιξ η«κ ιΆ¬δοι ? οθΆ¬ε κ§ο© ικ¬©νγ λ Άη©ο© Ά§ηοη κλ κ©¥ι΅ κ θ©΅ κλ ικ¬©νγ κεην§. κ¨ ο¤  λ οεγι κ§ο© ικ¬©νγ?",ιηοκ  ι΅ Άη©ο© ικ©¤γ΅ κλ κ«Άλ§Ά ικ¬©νγ ικαιν ΅ νηκ  Ά¥§ο£ ¦α΅ §©΅ ικ¬©νγ.,ιαι  κλ κκ£ι η«κ ιγκιοΆ η νι ικ¬©νγ  §νλ Άη©ο© ικ©¤γ΅. ,«Άθκι διη ικ¬©νγ νΆ¥§ο£ ­νι ιγκιοΆ ιΆλβοκο΅ , ιδ κκ£ι §©΅ ιγκιοΆ  Άη©ο© ιΆ§ηοη ικεην§. ,"¦ιηορ ? ο¤  γιξ κ§ο© ικ¬©νγ  ιδ κκ£ι §©΅ ιγκιοΆ  Άη©ο© ιΆ§ηοη ικεην§. [PMBOK ια γ΅ ι«§«΅ ? ι­ε¥΅ 121]",140,6,False,"""16""",Ahmad,,,
13,"A project manager has received reports from a supplier that he is over capacity, which may delay his delivery. What should the project manager update next? ",Schedule Baseline.,Stakeholder engagement plan. ,Issue log. ,Risk register.,"Since the report show that the delivery may delayed, so the project manager should update the risk register then perform analysis to assess the impact of this delay on the project. [PMBOK 6th edition. Page 453]","Άιηξ κ§ο© ικ¬©νγ Άη©ο© κλ ¥§ ικν©§ολ Άεο§  Ά¤ν αηΆμ ? κκ η§ ο›¦© Ά«ιοκμ. κ ι¨ο ο¤  γιξ κ§ο© ικ¬©νγ Ά¥§ο£μ  γ§ ¨ιθ?",γ§΅ ¤§νι΅ ¦α ι«« ικ©¤γο ικγΆκ§ ιι¤§νι ικλο.,¦α΅ ¬©θ ­¥  ικ­ι¥΅. ,«¤ι ικ¬θι΅. ,«¤ι ικ¦α©.,"λβ©ρ ιλ ιΆη©ο© ονΰ¥ λ ιΆ«ιοκ η§ οΆ¦© ? ι¨ιθ ο¤  γιξ κ§ο© ικ¬©νγ Ά¥§ο£ «¤ι ικ¦α© £κ ¤© Ά¥ιοι ιΆηοοκ Ά£ο© μ¨ ιΆ¦ο© γιξ ικ¬©νγ. [PMBOK ια γ΅ ι«§«΅ ? ι­ε¥΅ 453] ",147,5,False,"""19""",Ahmad,,,
14,"During the kick-off meeting, who should present the executing strategy of the project? ",Project Management Team,Project Sponsor,Directive PMO,Project manager,"The project manager is the responsible to presents the executing strategy of the project, and the sponsor responsible to present the organization strategy.","¦ιι ι¤Άκγ ιεΆΆ¥ο ιλαιη ικ¬©νγ ? κλ ο¤  λ οη§κ ι«Ά©Άο¤ο΅ ιΆλεο¨ο΅ ιικ¬©νγ? ",ε©οη §©΅ ικ¬©νγ,©γο ικ¬©νγ,κθΆ  §©΅ ικ¬©ογ ικν¤μ,κ§ο© ικ¬©νγ,"κ§ο© ικ¬©νγ μν ικ«›νι γλ Άη§οκ ι«Ά©Άο¤ο΅ ιΆλεο¨ο΅ ιικ¬©νγ ? νι©γο ικ«›νι γλ Άη§οκ «Ά©Άο¤ο΅ ικλβκ΅.",140,4,False,"""18""",Ahmad,,,
15,"You are managing a project that is in its first month of execution. In one of the meetings, a key stakeholder asks for some changes to be made in the ongoing work. The stakeholder is asking for the changes to be implemented immediately. You realize that the changes being asked for will require update the Project Management Plan and the Scope baseline, which have already been baselined. As a Project manager, which is the best course of action? ",Make the changes as they are being asked for by a key stakeholder ,Refuse to make the changes as it is a deviation from approved,Scope Analyze the impact of the changes on triple constraints,Generate a change request and submit it to Integrated change control ,Any changes being asked for or requested to any approved plan need to be formally reviewed by the Change Control Board. [PMBOK 6th edition. Page 113],"λΆ Ά§ο© κ¬©νγρ εο νι ¬μ© κλ Άλεο¨μ. εο ¥§ ι¤ΆκγΆ ? αι  ¥§ ­¥  ικ­ι¥΅ ι©ο«οολ ¤©  γΰ ιΆδοο©Ά εο ιγκι ι¤©ο. οαι  ­¥  ικ­ι¥΅ Άλεο¨ ιΆδοο©Ά γιξ ιεν©. λΆ Ά§©θ λ ιΆδοο©Ά ικαιν ΅ «ΆΆαι  Ά¥§ο£ ¦α΅ §©΅ ικ¬©νγ ν¦α ι«« ιιλαη ? ιι¨ολ Άκ Ά¥§ο§μκ  ιεγι. θκ§ο© κ¬©νγ ? κ μν εΰι κ«© ιιγκι?",ιηοκ  ¤© ιΆδοο©Ά θκ οαι μ ¥§ ­¥  ικ­ι¥΅ ι©ο«οολ ,©εΰ ¤© ιΆδοο©Ά ιλμ ογ§ λ¥©ερ γλ ικνεη΅,Ά¥ιοι Ά£ο© ιΆδοο©Ά  ιλαη γιξ ιηον§ ι£ι£ο΅,λ¬ αι  Άδοο© ν©«ιμ ιξ γκιο΅ ιΆ¥θκ ικΆθκι εο ιΆδοο© ,"ο¤  κ©¤γ΅ ο Άδοο©Ά οΆκ αι μ ν αι μ γιξ ο ¦α΅ κγΆκ§΅ ©«κορ κλ η ι ι¤λ΅ ιΆ¥θκ εο ιΆδοο©. [PMBOK ια γ΅ ι«§«΅ ? ι­ε¥΅ 113]",140,5,False,"""17""",Ahmad,,,
16,"After stakeholders in a company's sales department examined all the deliverables, they state that there has been a change in the company strategy. Therefore, important changes must be made to the requirements. The project manager believes that these changes make the deliverables unstable. What should the project manager do? ",Evaluate and incorporate the changes to the project management plan to start executing them. ,Request the details about the new requirements. evaluate them with the project team. and recommend whether to continue or close the project. ,Evaluate the impact on the project. coordinate with the sponsor and close the project.,Request that the stakeholders specify the new requirements and present them to the change control board (CCB). ,Since the changes are Important and MUST be made to the requirements so the PM need to make it. Any changes In project requirement can impact the baseline will require formal change request to take the approval from CCB. The project manager should request the stakeholders to specify the new requirements and present them to the change control board (CCB). Options of implement the changes without the approval of CCB are not correct . Also close the project after evaluate the Impact on project is not correct. [PMBOK 6th edition. Page. 167]," γ§ λ ηκ ­¥  ικ­ι¥΅ εο η«κ κ ογΆ ι¬©θ΅  ε¥­ ¤κογ ιΆ«ιοκΆ ? ¨θ©ν λμ θλ μλθ Άδοο© εο «Ά©Άο¤ο΅ ι¬©θ΅. ι¨ιθ ? ο¤  ¤© Άδοο©Ά κμκ΅ γιξ ικΆαι Ά. ογΆη§ κ§ο© ικ¬©νγ λ μ¨μ ιΆδοο©Ά Ά¤γι ιλνΆ¤ δο© κ«Άη©΅. κ¨ ο¤  λ οεγι κ§ο© ικ¬©νγ?",Άηοοκ ν§κ¤ ιΆδοο©Ά εο ¦α΅ §©΅ ικ¬©νγ ιι § εο Άλεο¨μ. ,αι  Άε­οι ικΆαι Ά ι¤§ο§΅. Άηοοκμ κγ ε©οη ικ¬©νγ. νιΆν­ο΅  ικΆ γ΅ ν διη ικ¬©νγ.,Άηοοκ ι£© γιξ ικ¬©νγ. ιΆλ«οη κγ ι©γο νδιη ικ¬©νγ.,αι  κλ ­¥  ικ­ι¥΅ Ά¥§ο§ ικΆαι Ά ι¤§ο§΅ νΆη§οκμ ιξ ι¤λ΅ ιΆ¥θκ εο ιΆδοο© (CCB). ,"λβ©ρ ιλ ιΆδοο©Ά κμκ΅ νο¤  ¤©›μ νεηρ ιικΆαι Ά ? ι¨ιθ ο¥Ά¤ κ§ο© ικ¬©νγ ιξ ¤©μ. ο Άδοο©Ά εο κΆαι Ά ικ¬©νγ οκθλ λ Ά›£© γιξ ¦α ι«« ικ©¤γο ικγΆκ§ «οΆαι  αι  Άδοο© ©«κο ι¦¨ ικνεη΅ κλ  ι¤λ΅ ιΆ¥θκ εο ιΆδοο©. ο¤  γιξ κ§ο© ικ¬©νγ λ οαι  κλ ­¥  ικ­ι¥΅ Ά¥§ο§ ικΆαι Ά ι¤§ο§΅ νΆη§οκμ ιξ  ι¤λ΅ ιΆ¥θκ εο ιΆδοο© (CCB). ¦ο©Ά Άλεο¨ ιΆδοο©Ά §νλ κνεη΅  ι¤λ΅ ιΆ¥θκ εο ιΆδοο© δο© ­¥ο¥΅. θκ διη ικ¬©νγ  γ§ Άηοοκ ι£© γιξ ικ¬©νγ δο© ­¥ο¥. [PMBOK ια γ΅ ι«§«΅ ? ι­ε¥΅ 167]",141,5,False,"""18""",Ahmad,,,
