IPMC |  All Questions ,,,,,,,,,,,,,,,,,,,,
452,You and your team have done extensive brainstorming and discussions. You have also looked up the organizations process assets and have come up with an exhaustive list of risks. You and your team members feel fairly confident now that you know all the risks. You decide to prioritize the risks and only focus on the high priority ones. A team member indicates that a large number of risks have very low priority. What should you do next? ,These risks can be dismissed ,Perform Quantitative Risk Analysis ,These risks can be accepted ,Update risk register ,"After performing Qualitative Risk Analysis, the Risk Register is updated included watch list which stated the low priority Risks for continued monitoring. [PMBOK 6th edition. Page 427].",ιη§ ¤©οΆ λΆ νε©οηθ γ­ε ¨μλο κθ£ε νκλη¬Ά. ιη§  ¥£Ά οΰρ γλ ­νι γκιοΆ ικλβκ΅ νΆν­ιΆ ιξ ηκ΅ ¬κι΅ ιικ¦α©. Ά¬γ© λΆ νγΰ ε©οηθ  ι£η΅ ιξ ¥§ κ ι™λ ιλθ Άγ©εΆ γιξ θι ικ¦α©. η©©Ά ιλ γα ινινο΅ ιικ¦α© νιΆ©θο εηα γιξ ικ¦α© ¨Ά ινινο΅ ιγιο΅. ¬© ¥§ γΰ ιε©οη ιξ λ γ§§ρ θ ο©ρ κλ ικ¦α© ιμ νινο΅ κλ¦εΰ΅ ¤§ρ. κ¨ ο¤  λ Άεγι  γ§ ¨ιθ?,οκθλ ©εΰ μ¨μ ικ¦α© ,¤© ιΆ¥ιοι ιθκο ιικ¦α© ,οκθλ η νι μ¨μ ικ¦α© ,Ά¥§ο£ «¤ι ικ¦α© ," γ§ ¤© ιΆ¥ιοι ιλνγο ιικ¦α© ? οΆκ Ά¥§ο£ «¤ι ικ¦α© ΰκλ ηκ΅ ικ©η ΅ ιΆο ¥§§Ά ικ¦α© ¨Ά ινινο΅ ικλ¦εΰ΅ ιικ©η ΅ ικ«Άκ©΅. [PMBOK ια γ΅ ι«§«΅. ι­ε¥΅ 427].",147,3,False,"""19""",Haitham,,,
453,"Your project manager has advised that you need to protect the organization from financial risk. In planning a new project, you realize there is a limited scope definition related to the work required to fulfill the contract. What is the best type of contract to choose? ",Time and material (T&M) ,Cost plus fixed fee (CPFF) ,Fixed price incentive fee (FPIF). ,Cost plus incentive fee (CPIF). ,"When you have a project with limited scope, the most suitable type of contract is Cost-reimbursable contracts. This type should be used if the scope of work is expected to change significantly during the execution of the contract. We have two types of Cost-reimbursable contracts in the options given ( Cost plus incentive fee and Cost plus a fixed fee. Both the risk lies on the buyer but Cost plus incentive fee the risk is lower than the cost plus fixed fee where the buyer has to pay a fixed fee along with the cost incurred, but the Cost plus incentive fee the buyer pays the fee based on achieving certain performance objectives mentioned in the contract. [PMBOK 6th edition, Page 472].","λ­¥θ κ§ο© ικ¬©νγ  λθ  ¥¤΅ ιξ ¥κο΅ ικλβκ΅ κλ ικ¦α© ικιο΅. γλ§ ιΆ¦αοα ικ¬©νγ ¤§ο§ ? §©θΆ λ μλθ Άγ©οε κ¥§ν§ ιλαη ιγκι ικαιν  ιινε  ιγη§. κ μν εΰι λνγ κλ ιγην§ οκθλ ¦Άο©μ?",ινηΆ νικν§ (T&M).,ιΆθιε΅ ικ«Ά©§΅  ιΰε΅ ιξ ι©«νκ ι£ Ά΅ (CPFF).,ιΆθιε΅ ι£ Ά΅ κγ ¥νε (FPIF). ,ιΆθιε΅ ικ«Ά©§΅  ιΰε΅ ιξ ι¥νε (CPIF). ,"γλ§κ οθνλ ι§οθ κ¬©νγ ¨ν λαη κ¥§ν§ ? ελ λ«  λνγ κλ ιγην§ μν γην§ ιΆθιε΅ ικ«Ά©§΅. ο¤  «Ά¦§κ μ¨ ιλνγ ¨ θλ κλ ικΆνηγ λ οΆδο© λαη ιγκι  ¬θι θ ο© £λ Άλεο¨ ιγη§. ι§ολ λνγλ κλ γην§ ιΆθιε΅ ιη ι΅ ιι«Ά©§§ εο ι¦ο©Ά ικη§κ΅ (ιΆθιε΅ ικ«Ά©§΅  ιΰε΅ ιξ ©«νκ ι¥νε νιΆθιε΅ ικ«Ά©§΅  ιΰε΅ ιξ ©«νκ £ Ά΅. Άηγ θι κλ ικ¦α© γιξ γΆη ικ¬Ά©ο νιθλ ιΆθιε΅ ικ«Ά©§΅  ιΰε΅ ιξ ©«νκ ι¥νε ? Άθνλ ικ¦α© ηι κλ ιΆθιε΅ ικ«Ά©§΅  ιΰε΅ ιξ ι©«νκ ι£ Ά΅ ¥ο£ οθνλ ικ¬Ά©ο ο¤  λ ο§εγ ©«κρ £ Άρ κγ ιΆθιε΅ ικΆθ §΅ ? νιθλ ιΆθιε΅ ικ«Ά©§΅  ιΰε΅ ιξ ©«νκ ι¥νε ο§εγ ικ¬Ά©ο ι©«νκ  λρ γιξ Ά¥ηοη μ§ε § κγολ΅ κ¨θν©΅ εο ιγη§. [PMBOK ια γ΅ ι«§«΅? ι­ε¥΅ 472].",148,3,False,"""20""",Haitham,,,
454,"By the project management information system (PMIS), a project management team is updating a dashboard monthly with information on the project's performance. Which of the following communication methods describes this? ",Interactive Communication ,Informal communication ,Manual communication ,Pull Communication ,"Since (dashboard) is update monthly with information on the project's performance to help the internal and external stakeholders to get the information any time by using the PMIS. its an example of pull communication. [PMBOK 6th edition, Page 374] ","κλ ¦ιι λβκ κγινκΆ §©΅ ικ¬©νγ (PMIS) ? οηνκ ε©οη §©΅ ικ¬©νγ  Ά¥§ο£ ιν¥΅ ηο« ι§ ¬μ©ορ  κγινκΆ γλ § ικ¬©νγ. ο κλ α©η ιΆ­ι ιΆιο΅ Ά­ε μ¨?",ιΆν­ι ιΆεγιο ,ιΆν­ι δο© ι©«κο ,ιΆ­ι ιο§νο ,ιΆ­ι  ι«¥ ,"Ά¥§ο£ (ιν¥΅ ηο« ι§) ¬μ©ορ  κγινκΆ γλ § ικ¬©νγ ικ«γ§΅ ­¥  ικ­ι¥΅ ι§¦ιοολ νι¦©¤οολ ιι¥­νι γιξ ικγινκΆ εο ο νηΆ  «Ά¦§κ PMIS. μν κ£ι γιξ ιΆν­ι  «¥  ι ολΆ. [PMBOK ια γ΅ ι«§«΅ ? ι­ε¥΅ 374]",146,3,False,"""19""",Haitham,,,
455,"You are a project manager for an construction project. During the implementation phase, you found that there is a great opportunity and you decide to transfer the ownership of an opportunity to a third party so that it shares some of the benefits if the opportunity occurs. Therefore, a joint venture was made with another company to catch these benefits. Now, you became responsible for the project as a whole. What will your next step be? ",Update Resource Management Plan ,Update Project Team Assignment ,Update Cost Management Plan ,Update Communication Management Plan ," Due to a joint venture was made So next step should be updated communication management plan because its contains Stakeholder communication requirements , Information to be communicated, including language, format, content, and level of detail, Timeframe and frequency for the distribution of required information and receipt of acknowledgment or response. [PMBOK 6th edition, Page 387] ","λΆ κ§ο© κ¬©νγ λ¬ο. ¦ιι κ©¥ι΅ ιΆλεο¨ ? ν¤§Ά λ μλθ ε©­΅ θ ο©΅ νη©©Ά ληι κιθο΅ ιε©­΅ ιξ α©ε £ι£  ¥ο£ ο¬©θ  γΰ ιεν§ εο ¥ι΅ ¥§ν£ ιε©­΅. ι¨ιθ ? Άκ λ¬ κ¬©νγ κ¬Ά©θ κγ ¬©θ΅ ¦©ξ ιι«Άε§΅ κλ μ¨μ ιεν§. ι™λ ? ­ ¥Ά κ«›νιρ γλ ικ¬©νγ θθι. κ¨ «Άθνλ ¦ανΆθ ιΆιο΅?",Ά¥§ο£ ¦α΅ §©΅ ικν©§ ,Ά¥§ο£ ΆγοολΆ ε©οη ικ¬©νγ ,Ά¥§ο£ ¦α΅ §©΅ ιΆθιε΅ ,Ά¥§ο£ ¦α΅ §©΅ ιΆ­ιΆ ," «   λ¬ ικ¬©νγ ικ¬Ά©θ ο¤  λ Άθνλ ι¦αν΅ ιΆιο΅ μο Ά¥§ο£ ¦α΅ §©΅ ιΆ­ιΆ ιλμ Ά¥Άνο γιξ κΆαι Ά ιΆν­ι κγ ­¥  ικ­ι¥΅ νικγινκΆ ιΆο «οΆκ Άν­οιμ ?  κ εο ¨ιθ ιιδ΅ νι¬θι νικ¥Άνξ νκ«Άνξ ιΆε­οι νια© ικλο νΆθ©© Άνογ ικγινκΆ ικαιν ΅ ν η©© «Άικμ ν ι©§. [PMBOK ια γ΅ ι«§«΅? ι­ε¥΅ 387]",146,4,False,"""19""",Haitham,,,
456,"A multiphase project that has been executed with internal resources has reached a phase gate. The key project stakeholders want to determine if the phase has met its success criteria, and whether or not the project should progress to the next phase. In addition to the project management plan, which documents will be required? ",Agreements including procurement contracts ,Lessons learned register and lessons learned repository ,Risk register and risk report ,Business documents and project charter ," The business documents and project charter are needed to determine whether or not the project should progress to the next phase. The project charter will provide the project's success criteria. The business documents include the business case and benefits management plan. The business case documents the business need and the cost-benefit analysis that justifies the project. The benefits management plan is used to measure whether the benefits of the project are being achieved as planned. [PMBOK 6th edition, Page 21] ","ν­ι κ¬©νγ κΆγ§§ ικ©¥ι Άκ Άλεο¨μ  κν©§ §¦ιο΅ ιξ λμο΅ ικ©¥ι΅. ο©ο§ ­¥  ικ­ι¥΅ ι©ο«ονλ εο ικ¬©νγ Ά¥§ο§ κ ¨ θλΆ ικ©¥ι΅ η§ «ΆνεΆ κγοο© ιλ¤¥ ι¦­΅  μ? νκ ¨ θλ ολ δο ιικ¬©νγ ιΆη§κ ιξ ικ©¥ι΅ ιΆιο΅ κ ι.  ιΰε΅ ιξ ¦α΅ §©΅ ικ¬©νγ? κ μο ικ«Άλ§Ά ικαιν ΅?",ιΆεηοΆ  κ εο ¨ιθ γην§ ι¬© ,«¤ι ι§©ν« ικ«Άε§΅ νκ«Άν§γ ι§©ν« ικ«Άε§΅ ,«¤ι ικ¦α© νΆη©ο© ικ¦α© ,ν£η ιγκι νκο£η ικ¬©νγ ,"ν£η ιγκι νκο£η ικ¬©νγ καιν ΅ ιΆ¥§ο§ κ ¨ θλ ικ¬©νγ ο¤  λ οΆη§κ ιξ ικ©¥ι΅ ιΆιο΅ κ ι. «ονε© κο£η ικ¬©νγ κγοο© λ¤¥ ικ¬©νγ. ΆΆΰκλ ν£η ιγκι §©«΅ ι¤§νξ ν¦α΅ §©΅ ιεν§. Άν£η §©«΅ ι¤§νξ ¥¤΅ ιγκι νΆ¥ιοι ιΆθιε΅ νιγ§ ι¨ο ο ©© ικ¬©νγ. οΆκ «Ά¦§κ ¦α΅ §©΅ ιεν§ ιηο« κ ¨ θλ οΆκ Ά¥ηοη εν§ ικ¬©νγ θκ μν κ¦αα κ ι. [PMBOK ια γ΅ ι«§«΅ ? ι­ε¥΅ 21]",140,3,False,"""19""",Haitham,,,
457,"You are a program manager of a project that is halfway through the execution. Because of the increased volatility of prices, one of the vendors asks you to make a price change that will affect the project contract. As a program manager, what should you do next? ",Ask the CCB for approval ,Implement the approved change ,Analyze the impact and Update the Project management plan ,Submit a change request and analyze the impact ," As a price change will affect the project contract, the project manager should Submit a change request and analyze the impact then take approval from CCB then update affected baselines then Implement the approved change. [PMBOK 6th edition, Page115]","λΆ κ§ο©  ©λκ¤ ικ¬©νγ εο κλΆ­ε κ©¥ι΅ ιΆλεο¨.  «   ιΆηι  ικΆο§ εο ι«γ© ? οαι  ¥§ ι γολ κλθ ¤© Άδοο© εο ι«γ© κλ ¬λμ λ ο›£© γιξ γη§ ικ¬©νγ. θκ§ο©  ©λκ¤ ? κ¨ ο¤  λ Άεγι  γ§ ¨ιθ?",αι  ικνεη΅ κλ ι¤λ΅ ιΆ¥θκ  ιΆδοο©Ά ,Άλεο¨ ιΆδοο© ικγΆκ§ ,Ά¥ιοι ιΆ£ο© νΆ¥§ο£ ¦α΅ §©΅ ικ¬©νγ ,©«ι αι  Άδοο© νΆ¥ιοι ιΆ£ο© ,"λβ©ρ ιλ Άδοο© ι«γ© «ο›£© γιξ γη§ ικ¬©νγ ? ο¤  γιξ κ§ο© ι ©λκ¤ ©«ι αι  Άδοο© νΆ¥ιοι ιΆ£ο© £κ ι¥­νι γιξ ικνεη΅ κλ ι¤λ΅ ιΆ¥θκ  ιΆδοο©Ά  £κ Ά¥§ο£ ¦ανα ι«« ικΆ£©΅ £κ Άλεο¨ ιΆδοο© ικγΆκ§. [PMBOK ια γ΅ ι«§«΅? ι­ε¥΅115]",140,5,False,"""19""",Haitham,,,
458,"While reviewing the statement of work (SOW) for the project, four stakeholders not agree on what the project should include. As a project manager, What should you do? ",Document the conflict in the issue log before participating in the development of the project charter. ,Include the stakeholders' comments for future reference in the project charter. ,Document the stakeholders' points but include the remaining stakeholders' input in final decision making. ,Hold a meeting with the four stakeholders to resolve the conflict and reach agreement. ,"Conflict management is a part of Interpersonal and team skills that can be used for the initiation process. Conflict management can be used to help bring stakeholders into alignment on the objectives, success criteria, high-level requirements, project description, summary milestones, and other elements of the charter. so the project manager should be proactive and meet with the four stakeholders to resolve the conflict and reach an agreement. [PMBOK 6th edition, Page 80]","£λ κ©¤γ΅  ολ ιγκι (SOW) ιικ¬©νγ ? ικ οΆεη © γ΅ κλ ­¥  ικ­ι¥΅ γιξ κ ο¤  λ οΆΰκλμ ικ¬©νγ. θκ§ο© κ¬©νγ ? κ¨ ο¤  λ Άεγι?",Άν£οη ιΆγ©ΰ εο «¤ι ι¥§£ η ι ικ¬©θ΅ εο Άανο© κο£η ικ¬©νγ. ,ηκ  Άΰκολ ΆγιοηΆ ­¥  ικ­ι¥΅ ιι©¤νγ ιομ εο ικ«Άη ι εο κο£η ικ¬©νγ. ,ηκ  Άν£οη ληα ­¥  ικ­ι¥΅ νιθλ ηκ  Άΰκολ κ§¦ιΆ ­¥  ικ­ι¥΅ ικΆ ηολ εο Ά¦¨ ιη©© ιλμο. ,γη§ ¤Άκγ κγ ­¥  ικ­ι¥΅ ι© γ΅ ι¥ι ιλγ νιΆν­ι ιξ Άεη. ,"Άγ§ §©΅ ι­©γ ¤ρ κλ ικμ©Ά ι¬¦­ο΅ νι¤κγο΅ ιΆο οκθλ «Ά¦§κμ εο γκιο΅ ι §. οκθλ «Ά¦§κ §©΅ ι­©γ ικ«γ§΅ ­¥  ικ­ι¥΅ εο ικνκ΅ κγ ιμ§ε νκγοο© ιλ¤¥ νικΆαι Ά γιο΅ ικ«Άνξ νν­ε ικ¬©νγ νκι¦­ ικγικ νιγλ­© ι¦©ξ ιικο£η. ι¨ιθ ο¤  λ οθνλ κ§ο© ικ¬©νγ «Ά ηορ νλ ο¤Άκγ κγ ­¥  ικ­ι¥΅ ι© γ΅ ι¥ι ιλγ νιΆν­ι ιξ Άεη. [PMBOK ια γ΅ ι«§«΅ ? ι­ε¥΅ 80]",145,4,False,"""20""",Haitham,,,
459,A project manager was assigned to a project when the project charter was in development. Which of the following is an input that the project manager will use to develop the project charter? ,Enterprise environmental factors and Project Acceptance Criteria ,Agreements and Make-or-Buy analysis ,Organizational Process Assets and Project Scope Statement ,Cost Benefit Analysis and organizational strategies ," A business case includes Cost-Benefit Analysis and organizational strategies. [PMBOK 6th edition, Page 68,75] ",Άκ Άγοολ κ§ο© κ¬©νγ γλ§κ θλ κο£η ικ¬©νγ ηο§ ιΆανο©. ο κκ οιο ογ§ ¥§ ικ§¦ιΆ ιΆο «ο«Ά¦§κμ κ§ο© ικ¬©νγ ιΆανο© κο£η ικ¬©νγ?,ιγνκι ι οο΅ ιικ›««΅ νκγοο© η νι ικ¬©νγ ,ιΆεηοΆ νΆ¥ιοι ι­λγ ν ι¬© ,­νι ιγκιο΅ ιΆλβοκο΅ ν ολ λαη ικ¬©νγ ,Ά¥ιοι ιΆθιε΅ νικλεγ΅ νι«Ά©Άο¤οΆ ιΆλβοκο΅ ,"ΆΆΰκλ §©«΅ ι¤§νξ «Ά©Άο¤οΆ Ά¥ιοι ιΆθιε΅ νικλεγ΅ νι«Ά©Άο¤οΆ ιΆλβοκο΅. [PMBOK ια γ΅ ι«§«΅ ? ι­ε¥΅ 68?75]",140,2,False,"""20""",Haitham,,,
460,"You are working on a project to construct villa in your city, and you are about to start project planning. As a starting point for initial project planning, what is the first thing you should do? ",Conduct a project kick-off meeting to inform and engage stakeholders and gain commitment. ,Begin the process of identifying stakeholders so they can be engaged as necessary for project planning. ,Develop the project schedule to manage timely completion of the project ,Review the project charter to understand the high-level information about the project. ," The question states that project planning is about to begin which suggests that project initiation has been completed. The project charter is created during the Develop Project Charter process as part of project initiation. The project team uses the project charter as a starting point for initial project planning. The type and amount of information in the project charter varies depending on the complexity of the project and the information known at the time of its creation. At a minimum, the project charter should define the high-level information about the project that will be elaborated in the various components of the project management plan. [PMBOK 6th edition, Page 81].","λΆ Άγκι γιξ κ¬©νγ ι λ εοι εο κ§ολΆθ ? νλΆ γιξ ν¬θ ι § εο Ά¦αοα ικ¬©νγ. θληα΅ λαιη ιιΆ¦αοα ινιο ιικ¬©νγ ? κ μν νι ¬ο ο¤  γιοθ εγιμ?",γη§ ¤Άκγ αιη ικ¬©νγ ιγικ ν¬©θ ­¥  ικ­ι¥΅ νθ«  ιιΆκ. , § γκιο΅ Ά¥§ο§ ­¥  ικ­ι¥΅ ¥Άξ οκθλ ¬©θμκ γλ§ ιΰ©ν©΅ ιΆ¦αοα ικ¬©νγ. ,Άανο© ι¤§νι ικλο ιικ¬©νγ ι§©΅ ιλΆμ κλ ικ¬©νγ εο ινηΆ ικλ«  ,©¤γ κο£η ικ¬©νγ ιεμκ ικγινκΆ γιο΅ ικ«Άνξ ¥νι ικ¬©νγ. ,"ο¬ο© ι«›ι ιξ λ Ά¦αοα ικ¬©νγ γιξ ν¬θ ι § κκ ο¬ο© ιξ λ  § ικ¬©νγ η§ θΆκι. οΆκ λ¬ κο£η ικ¬©νγ £λ γκιο΅ Άανο© κο£η ικ¬©νγ θ¤ κλ  § ικ¬©νγ. ο«Ά¦§κ ε©οη ικ¬©νγ κο£η ικ¬©νγ θληα΅ λαιη ιιΆ¦αοα ινιο ιικ¬©νγ. ο¦Άιε λνγ νθκο΅ ικγινκΆ εο κο£η ικ¬©νγ Ά γρ ικ§ξ Άγηο§ ικ¬©νγ νικγινκΆ ικγ©νε΅ νηΆ λ¬μ. θ¥§ §λξ? ο¤  λ ο¥§§ κο£η ικ¬©νγ ικγινκΆ γιο΅ ικ«Άνξ ¥νι ικ¬©νγ ιΆο «οΆκ νΰγμ εο ικθνλΆ ικ¦Άιε΅ ι¦α΅ §©΅ ικ¬©νγ. [PMBOK ια γ΅ ι«§«΅? ι­ε¥΅ 81].",140,3,False,"""20""",Haitham,,,
461,"During the execution phase, the project owner left the project and a new sponsor has been assigned. What should you do next? ",Update RACI Chart ,Update the Project Management Plan ,Update Stakeholder Engagement Plan ,Update the stakeholder register ,"When identifying a new stakeholder during the project, the First step is to update the Stakeholder register. [PMBOK 6th edition, Page 529]","¦ιι κ©¥ι΅ ιΆλεο¨ ? δ§© κιθ ικ¬©νγ νΆκ Άγοολ ©γο ¤§ο§ ιικ¬©νγ. κ¨ ο¤  λ Άεγι  γ§ ¨ιθ?",Ά¥§ο£ κ¦αα Άνογ ικμκ RACI ,Ά¥§ο£ ¦α΅ §©΅ ικ¬©νγ ,Ά¥§ο£ ¦α΅ ¬©θ ­¥  ικ­ι¥΅ ,Ά¥§ο£ «¤ι ­¥  ικ­ι¥΅ ,"γλ§ Ά¥§ο§ ­¥  κ­ι¥΅ ¤§ο§ £λ ικ¬©νγ ? ελ ι¦αν΅ ινιξ μο Ά¥§ο£ «¤ι ­¥  ικ­ι¥΅. [PMBOK ια γ΅ ι«§«΅ ? ι­ε¥΅ 529]",149,4,False,"""16""",Haitham,,,
462,"You are a project manager in a infrastructure project. During a review, the site engineer informs you that the concrete production rate has changed over the last three months. What analysis should be conducted? ",Control chart ,Earned value (EV). ,Scatter diagram ,Trend analysis ,"Trend analysis examines project performance over time to determine whether performance is improving or deteriorating. Graphical analysis techniques are valuable for understanding performance to date and for comparing to future performance goals in the form of completion dates. [PMBOK 6th edition, Page 227] ","λΆ κ§ο© κ¬©νγ εο κ¬©νγ  λο΅ Ά¥Άο΅. £λ ικ©¤γ΅ ? ¦ ©θ κμλ§« ικνηγ λ κγ§ι λΆ¤ ι¦©«λ΅ η§ Άδο© ¦ιι ι¬μ© ι£ι£΅ ικΰο΅. κ μν ιΆ¥ιοι ι¨ο ο¤  ¤©›μ?",κ¦αα ιΆ¥θκ ,ιηοκ΅ ικθΆ« ΅ (EV). ,κ¦αα ιΆ¬ΆΆ ,Ά¥ιοι ιΆ¤μ ,"οε¥­ Ά¥ιοι ιΆ¤μΆ § ικ¬©νγ  κ©ν© ινηΆ ιΆ¥§ο§ κ ¨ θλ ι§ οΆ¥«λ ν οΆ§μν©. ΆγΆ © ΆηλοΆ ιΆ¥ιοι ι©«νκο΅ ¨Ά ηοκ΅ ιεμκ ι§ ι¥ιο νιικη©λ΅  μ§ε ι§ ικ«Άη ιο΅ εο ¬θι Άν©ο¦ ιλΆμ. [PMBOK ια γ΅ ι«§«΅ ? ι­ε¥΅ 227]",142,5,False,"""19""",Haitham,,,
463,You have recently been assigned as the project manager for a company that has a history of implementing system integration projects and you don't have prior experience. What should you do? ,Meet with the sponsor ,Review the project charter ,Refer to the project statement of work (SOW). ,Seek expert judgment ,"Since you don't have prior experience, so you should seek expert judgment. [PMBOK 6th edition, Page 94]",ιη§ Άκ Άγοολθ κ›¦©ρ θκ§ο© κ¬©νγ ι¬©θ΅ ι§ομ Ά©ο¦ εο Άλεο¨ κ¬©ογ Άθκι ιλβκ΅ νιο« ι§οθ ¦ ©΅ « η΅. κ¨ γιοθ λ Άεγι?,ι¤Άκγ κγ ©γο ικ¬©νγ ,©¤γ κο£η ικ¬©νγ ,ι©¤νγ ιξ  ολ γκι ικ¬©νγ (SOW). , ¥£ γλ ©ο ι¦ © ," «   λμ ιο« ι§οθ ¦ ©΅ « η΅? ι¨ιθ ο¤  γιοθ ι«γο ιι¥­νι γιξ ©ο ι¦ ©. [PMBOK ια γ΅ ι«§«΅ ? ι­ε¥΅ 94]",140,4,False,"""18""",Haitham,,,
464,"You has been assigned as a project manager, you are managing a software development project. As a result of observation and conversation, you notice some of the team members need to improve their skills. What should you do FIRST? ",Update Cost Baseline ,Schedule training sessions for the team members to optimize their performance. ,Acquire new members ,Review the Resource Management Plan ,"The Resource Management Plan include training strategies and methods for developing the project team. [PMBOK 6th edition, Page 319] ","ιη§ Άκ Άγοολθ θκ§ο© κ¬©νγ ? λΆ Ά§ο© κ¬©νγ Άανο©  ©κ¤οΆ. θλΆο¤΅ ιικι¥β΅ νικ¥§£΅? Άι¥β λ  γΰ γΰ ιε©οη  ¥¤΅ ιξ Ά¥«ολ κμ©Άμκ. κ ι¨ξ ολ δξ γιοθ εγιμ νι?",Ά¥§ο£ ¦α «« ιΆθιε΅ ,ηκ  ¤§νι΅ ¤ι«Ά Ά§©ο ο΅ ιγΰ ιε©οη ιΆ¥«ολ §μκ.,θΆ«  γΰ ¤§§ ,©¤γ ¦α΅ §©΅ ικν©§ ,"ΆΆΰκλ ¦α΅ §©΅ ικν©§ «Ά©Άο¤οΆ ιΆ§©ο  να©η Άανο© ε©οη ικ¬©νγ. [PMBOK ια γ΅ ι«§«΅ ? ι­ε¥΅ 319]",145,3,False,"""20""",Haitham,,,
465,"You are a project manager in an IT project. During the deployment of a new system, an unexpected power outage occurs. What should the project manager do? ",Risk categorization. ,Risk probability and impact assessment.,Perform a qualitative risk analysis .,Refer to the risk register and inform key stakeholder.,"As an unexpected power outage occurs, the project manager should first Refer to the risk register and inform key stakeholders to handle this scenario. Risk categorization and Risk probability and impact assessment are T&T in Perform a qualitative risk analysis process, therefore they can be excluded. [PMBOK 6th edition, Page 411, 458].","λΆ κ§ο© κ¬©νγ εο κ¬©νγ Άηλο΅ κγινκΆ. £λ λ¬© λβκ ¤§ο§ ? ¥§£ ληαγ δο© κΆνηγ ιιΆο© ιθμ© ο. κ¨ ο¤  λ οεγι κ§ο© ικ¬©νγ?",Ά­λοε ικ¦α© .,Άηοοκ ¥Άκιο΅ ¥§ν£ ικ¦α© νΆ£ο©μ. ,¤© Ά¥ιοι λνγο ιικ¦α© .,ι©¤νγ ιξ «¤ι ικ¦α© ν ιδ ­¥  ικ­ι¥΅ ι©ο«οολ.,"γλ§ ¥§ν£ ληαγ δο© κΆνηγ ιιΆο© ιθμ© ο? ο¤  γιξ κ§ο© ικ¬©νγ ι©¤νγ νιρ ιξ «¤ι ικ¦α© ν ιδ ­¥  ικ­ι¥΅ ι©ο«οολ ιιΆγκι κγ μ¨ ι«ολ©ον. Ά­λοε ικ¦α©? νΆηοοκ ¥Άκιο΅ ¥§ν£ ικ¦α© νΆ£ο©μ μο §νΆ νΆηλοΆ εο ¤© γκιο΅ Ά¥ιοι ικ¦α© ιλνγο΅ ? ν ιΆιο οκθλ «Ά γ§μ. [PMBOK ια γ΅ ι«§«΅? ι­ε¥΅ 411? 458].",147,5,False,"""18""",Haitham,,,
466,"During the middle of the project, the project manager has been exposed to an accident, and a new project manager has been assigned. What should the new project manager do next? ",Update organizational process assets (OPA) ,Update resource calendar ,Update project charter ,Update project management plan ,"Since he is a new project manager, so the communication management plan should be updated. Also, the resource management plan is a component of the project management plan. Option update project charter is incorrect because the sponsor who can update or modify the project charter according to PMBOK. ","¦ιι κλΆ­ε ικ¬©νγ ? Άγ©ΰ κ§ο© ικ¬©νγ ι¥§£ ? νΆκ Άγοολ κ§ο© κ¬©νγ ¤§ο§. κ¨ ο¤  λ οεγι κ§ο© ικ¬©νγ ι¤§ο§  γ§ ¨ιθ?",Ά¥§ο£ ­νι ιγκιο΅ ιΆλβοκο΅ (OPA) ,Ά¥§ο£ Άηνοκ ικν©§ ,Ά¥§ο£ κο£η ικ¬©νγ ,Ά¥§ο£ ¦α΅ §©΅ ικ¬©νγ ,"λβ©ρ ιλμ κ§ο© κ¬©νγ ¤§ο§? ο¤  Ά¥§ο£ ¦α΅ §©΅ ιΆ­ιΆ. θκ λ ¦α΅ §©΅ ικν©§ μο ¥§ κθνλΆ ¦α΅ §©΅ ικ¬©νγ. ¦ο© Ά¥§ο£ κο£η ικ¬©νγ δο© ­¥ο¥ ιλ ι©γο οκθλμ Ά¥§ο£ ν Άγ§οι κο£η ικ¬©νγ νεηρ ι• PMBOK.",147,4,False,"""20""",Haitham,,,
467,"Using the following values, calculate the Management reserve: 
Project Budget = 100,000
EAC = 120,000
AC = 5,500
BAC=70,000 ","70,000","40,000","100,000","30,000"," The Management reserve = Project Budget - BAC. Therefore, 100,000 - 70,000 = 30,000. [PMBOK 6th edition. Page 267]. "," «Ά¦§κ ιηοκ ιΆιο΅ ? ¥«  ¥Άοαο ι§©΅: 
κολο΅ ικ¬©νγ = 100?000 
ιΆη§ο© γλ§ ιλΆμ EAC = 120?000
ιΆθιε΅ ιεγιο΅  AC = 5?500
ικολο΅ γλ§ ιθΆκι  BAC = 70?000","70,000","40,000","100,000","30,000","¥Άοαο ι§©΅ = κολο΅ ικ¬©νγ - BAC.
ι¨ιθ? 100,000 - 70,000 = 30,000
[PMBOK ια γ΅ ι«§«΅. ι­ε¥΅ 267].",143,5,False,"""17""",Haitham,,,
