IPMC |  All Questions ,,,,,,,,,,,,,,,,,,,,
151,"During execution, a project manager identifies a major obstacle that is delay progress. An escalation to the client's project manager has gone unanswered, and project progress is worsening each week. What should the project manager do? ",Inform the supervisor of the client's project manager,"Follow the escalation matrix in the project management plan, and escalate it to the next level",Escalate the issue directly to the steering committee,Revise the communication management plan,"Since (Escalation has gone unanswered), so its a communication issue and the project manager should revise the communication management plan because its contains the escalation processes with person or groups who will receive the information, methods or technologies used to convey the information, such as memos, email, press releases, or social media and method for updating and refining the communications management plan. [PMBOK 6th edition Page, 377] ","£λ ιΆλεο¨ ? ο¥§§ κ§ο© ικ¬©νγ γη ΅ ©ο«ο΅ ΆΆκ£ι εο Ά¦ο© ιΆη§κ. ικ οΆκ ι©§ γιξ ιΆ­γο§ ιξ κ§ο© κ¬©νγ ιγκοι ? νο§§ Άη§κ ικ¬©νγ «νρ θι « νγ. κ¨ ο¤  λ οεγι κ§ο© ικ¬©νγ?", ιδ ικ¬©ε  κ§ο© κ¬©νγ ιγκοι,"Ά γ κ­ενε΅ ιΆ­γο§ εο ¦α΅ §©΅ ικ¬©νγ ? νηκ  Ά­γο§μ ιξ ικ«Άνξ ιΆιο",Ά­γο§ ικ«ι΅ κ ¬©΅ ιξ ιι¤λ΅ ιΆν¤ομο΅,κ©¤γ΅ ¦α΅ §©΅ ιΆ­ιΆ,"λβ©ρ ιλ (ιΆ­γο§ ικ οΆκ ι©§ γιομ) ? εμ¨μ κ¬θι΅ Ά­ι νο¤  γιξ κ§ο© ικ¬©νγ κ©¤γ΅ ¦α΅ §©΅ ιΆ­ιΆ ιλμ Ά¥Άνο γιξ γκιοΆ ιΆ­γο§ κγ ¬¦­ ν κ¤κνγΆ «ΆΆιηξ ικγινκΆ ν ι«ιο  ν ιΆηλοΆ ικ«Ά¦§κ΅ ιληι ικγινκΆ ? κ£ι ικ¨θ©Ά ν ι ©ο§ ιιθΆ©νλο ν ι ολΆ ι­¥εο΅ ν ν«ι ιΆν­ι ι¤Άκγο να©οη΅ Ά¥§ο£ νΆ¥«ολ ¦α΅ §©΅ ιΆ­ιΆ. [PMBOK ια γ΅ ι«§«΅ ? ι­ε¥΅ 377]",146,4,False,"""19""",Ahmad,,,
152,"During a weekly status meeting, a team member informs the project manager that the design submitted to the local government for approval has been rejected due to an error in the blueprint. Resubmission of the design will require an additional two weeks. What should the project manager do first? ",Review the reject submission and begin working on the resubmission,Add another layer of review for future projects to avoid similar problems,Inform the project sponsor and look for support,Update the issue log and identify the possible cause of the error,"Resubmission of the design will require an additional two weeks this Is an issue and the project manager should FIRST update the issue log and identify the possible cause of the error. [PMBOK 6th edition Page, 96] ","¦ιι ¤Άκγ ι¥ι΅ ι« νγο ? οηνκ ¥§ γΰ ιε©οη   ιδ κ§ο© ικ¬©νγ  λ ιΆ­κοκ ικη§κ ιξ ι¥θνκ΅ ικ¥ιο΅ ιικνεη΅ γιομ η§ Άκ ©εΰμ  «   ¦α εο ικ¦αα. «οΆαι  γ§΅ Άη§οκ ιΆ­κοκ « νγολ ΰεοολ. κ ι¨ο ο¤  λ οεγιμ κ§ο© ικ¬©νγ νιρ?",©¤γ Άη§οκ ι©εΰ ν § εο ιγκι γιξ γ§΅ ιΆη§οκ,ΰε α η΅ ¦©ξ κλ ικ©¤γ΅ ιικ¬©ογ ικ«Άη ιο΅ ιΆ¤λ  κ¬θι κκ£ι΅, ιδ ©γο ικ¬©νγ ν ¥£ γλ ι§γκ,ηκ  Ά¥§ο£ «¤ι ικ¬θι ν¥§§ ι«   ικ¥Άκι ιι¦α,"«ΆΆαι  γ§΅ Άη§οκ ιΆ­κοκ « νγολ ΰεοολ ? νμ¨μ κ¬θι΅ νο¤  γιξ κ§ο© ικ¬©νγ νιρ Ά¥§ο£ «¤ι ικ¬θι νΆ¥§ο§ ι«   ικ¥Άκι ιι¦α. [PMBOK ια γ΅ ι«§«΅ ? ι­ε¥΅ 96]",140,4,False,"""20""",Ahmad,,,
153,"A project to develop a new product contains many stakeholders who are trying to influence the project but have conflicting interests. The project manager has just completed the project charter and is working on the project management plan, which only gives a high-level view of both the product specifications and the project scope. What should the project manager do next to build a detailed scope description? ",List all concerns in the stakeholder engagement plan ,Create the work breakdown structure. WBS ,Develop the scope statement with stakeholder input. ,Implement the plan scope management process. ,"The project manager has only completed the project charter and now is working on planning. So the first process in the planning is plan scope management, that helps in know how to collect requirement , how to build a detailed scope description, how to create WBS, and how formal acceptance of the completed project deliverables will be obtained. [PMBOK 6th edition Page, 137]","ο¥Άνο κ¬©νγ Άανο© κλΆ¤ ¤§ο§ γιξ ιγ§ο§ κλ ­¥  ικ­ι¥΅ ι¨ολ ο¥νινλ ιΆ£ο© γιξ ικ¬©νγ νιθλ ι§ομκ κ­ι¥ κΆΰ© ΅. θκι κ§ο© ικ¬©νγ ιιΆν κο£η ικ¬©νγ νογκι γιξ ¦α΅ §©΅ ικ¬©νγ ? νιΆο ι Άη§κ «νξ ©›ο΅ γιο΅ ικ«Άνξ ιθι κλ κν­εΆ ικλΆ¤ νλαη ικ¬©νγ. κ ι¨ο ο¤  λ οεγιμ κ§ο© ικ¬©νγ  γ§ ¨ιθ ι λ ν­ε κε­ι ιιλαη?",ΰγ ηκ΅  ¤κογ ικ¦νε εο ¦α΅ ¬©θ ­¥  ικ­ι¥΅ ,λ¬ μοθι Άλβοκ ιγκι. WBS,Άανο©  ολ ιλαη κγ κ§¦ιΆ ­¥  ικ­ι¥΅. ,Άλεο¨ γκιο΅ §©΅ ιλαη  ,"θκι κ§ο© ικ¬©νγ κο£η ικ¬©νγ εηα νογκι ι™λ γιξ ιΆ¦αοα. ι¨ ελ ιγκιο΅ ινιξ εο ιΆ¦αοα μο §©΅ ιλαη ? νιΆο Ά«γ§ εο κγ©ε΅ θοεο΅ ¤κγ ικΆαι Ά ? νθοεο΅  λ ν­ε κε­ι ιιλαη ? νθοεο΅ λ¬ WBS ? νθοε «οΆκ ι¥­νι γιξ ιη νι ι©«κο ιΆ«ιοκΆ ικ¬©νγ ικθΆκι΅. [PMBOK ια γ΅ ι«§«΅ ? ι­ε¥΅ 137]",141,3,False,"""19""",Ahmad,,,
154,"A global technology company invested in an infrastructure upgrade project as a part of its business strategy. During the planning phase, the project team works with stakeholders to identify project requirements. The project manager is having difficulty engaging stakeholders who work internationally in different time zones. The stakeholders are unable to participate in regularly scheduled planning meetings, and often don't provide timely responses to emails and other requests for information. What should the project manager do next to minimize the impact this issue may have on the project? ",Arrange a meeting to discuss the issue. ,Alert senior management. ,Create a resource management plan. ,Create a communication management plan. ,"The project manager is having difficulty engaging stakeholders who work internationally In different time zones and stakeholders are unable to participate in regularly scheduled planning meetings, so the project manager should create a communication management plan to minimize the impact this issue may have on the project. [PMBOK 6th edition Page, 137]","«Ά£κ©Ά ¬©θ΅ Άηλο΅ γικο΅ εο κ¬©νγ Ά©ηο΅ ι λο΅ ιΆ¥Άο΅ θ¤ κλ «Ά©Άο¤ο΅ γκιμ. ¦ιι κ©¥ι΅ ιΆ¦αοα ? ογκι ε©οη ικ¬©νγ κγ ­¥  ικ­ι¥΅ ιΆ¥§ο§ κΆαι Ά ικ¬©νγ. ον¤μ κ§ο© ικ¬©νγ ­γν ΅ εο ¬©θ ­¥  ικ­ι¥΅ ι¨ολ ογκινλ §νιορ εο κλαη κλο΅ κ¦Άιε΅. ι ο«Άαογ ­¥  ικ­ι¥΅ ικ¬©θ΅ εο ¤ΆκγΆ ιΆ¦αοα ικ¤§νι΅  λΆβκ ? νι οη§κνλ εο ιδι  ©§ν§ρ εο ινηΆ ικλ«  γιξ ©«ι ι ©ο§ ιιθΆ©νλο ναι Ά ικγινκΆ ι¦©ξ. κ ι¨ο ο¤  λ οεγιμ κ§ο© ικ¬©νγ  γ§ ¨ιθ ιΆηιοι Ά£ο© μ¨μ ικ¬θι΅ γιξ ικ¬©νγ?",©Ά  ¤Άκγρ ικλη¬΅ ικ¬θι΅. ,Άλ ομ ι§©΅ ιγιο. ,ηκ  λ¬ ¦α΅ §©΅ ικν©§. ,νΰγ ¦α΅ ι§©΅ ιΆ­ιΆ. ,"ον¤μ κ§ο© ικ¬©νγ ­γν ΅ εο ¬©θ ­¥  ικ­ι¥΅ ι¨ολ ογκινλ §νιορ εο κλαη κλο΅ κ¦Άιε΅ νι οΆκθλ ­¥  ικ­ι¥΅ κλ ικ¬©θ΅ εο ¤ΆκγΆ ιΆ¦αοα ικ¤§νι΅  λΆβκ ? ι¨ιθ ο¤  γιξ κ§ο© ικ¬©νγ λ¬ ¦α΅ §©΅ Ά­ιΆ ιΆηιοι ιΆ£ο© ι¨ο η§ Ά¥§£μ μ¨μ ικ¬θι΅ γιξ ικ¬©νγ. [PMBOK 6th edition Page? 137]",146,3,False,"""17""",Ahmad,,,
155,"During the execution phase, a project manager discovers that team members have started to work on task that are coming directly from the customer. What should the project manager do? ",Split the project into two projects to keep the scopes separate and bill the client separately. ,Continue working on tasks that have already been started and revise the baseline ,Hold a risk review board meeting and add the tasks that have already been started to the risk log. ,Stop the work that is outside the project scope statement and submit a change request. ,"The project manager should stop the work that is outside the project scope statement and submit a change request to take the approval from CCB, and only do the works included in the project scope statement or the approved change request. [PMBOK 6th edition Page, 90]","£λ κ©¥ι΅ ιΆλεο¨ ? οθΆ¬ε κ§ο© ικ¬©νγ λ γΰ ιε©οη η§  §ν ιγκι εο κμκ΅ ΆΆο κ ¬©΅ κλ ιγκοι. κ¨ ο¤  λ οεγι κ§ο© ικ¬©νγ?",η«‘κ ικ¬©νγ ιξ κ¬©νγολ ιι η γιξ ιλαηΆ κλε­ι΅ νεΆν©΅ ιγκοι  ¬θι κλε­ι. ,«Άκ© εο ιγκι γιξ ικμκ ιΆο  §Ά  ιεγι νηκ  κ©¤γ΅ ι«« ,γη§ ¤Άκγρ ικ¤ι« §©΅ κ©¤γ΅ ικ¦α© νΰε ικμκ ιΆο  §Ά  ιεγι ιξ «¤ι ικ¦α©. ,νηε ιγκι ι¨ο οηγ ¦©¤  ολ λαη ικ¬©νγ ν©«ι αι  ιΆδοο©. ,"ο¤  γιξ κ§ο© ικ¬©νγ οηε ιγκι ι¨ο οηγ ¦©¤  ολ λαη ικ¬©νγ νΆη§οκ αι  Άδοο© ιι¥­νι γιξ ικνεη΅ κλ ι¤λ΅ ιΆ¥θκ εο ιΆδοο© CCB ? νιηοκ εηα  ιγκι ικ§©¤΅ εο  ολ λαη ικ¬©νγ ν αι  ιΆδοο© ικγΆκ§. [PMBOK ια γ΅ ι«§«΅ ? ι­ε¥΅ 90]",140,4,False,"""18""",Ahmad,,,
156,You are a project manager and have just assigned to the project in the execution phase. A project is in jeopardy. It is behind schedule and resources are limited. What is the first action you should take? ,Hold a project team meeting. ,Review the work performance report. ,Ask management for additional resources. ,Revise the project management plan ,"When a project manager assign in the execution phase, the first action should be taken is Revise (Review) the project management plan. [PMBOK 6th edition Page, 90]",λΆ κ§ο© κ¬©νγ νΆκ ιιΆν Άγοολθ ιικ¬©νγ εο κ©¥ι΅ ιΆλεο¨. ικ¬©νγ εο ¦α©. λμ κΆ¦© γλ ι¤§νι ικλο νικν©§ κ¥§ν§΅. κ μν ι¤© ινι ι¨ο ο¤  λ Άηνκ  μ?,γη§ ¤Άκγ ε©οη ικ¬©νγ. ,κ©¤γ΅ Άη©ο© § ιγκι. ,αι  κλ ι§©΅ κν©§ ΰεο΅. ,κ©¤γ΅ ¦α΅ §©΅ ικ¬©νγ ,"γλ§κ οΆκ Άγοολ κ§ο© ικ¬©νγ εο κ©¥ι΅ ιΆλεο¨ ? ι¤© ινι ι¨ο ο¤  Ά¦¨μ μν κ©¤γ΅  ¦α΅ §©΅ ικ¬©νγ. [PMBOK ια γ΅ ι«§«΅ ? ι­ε¥΅ 90]",140,4,False,"""19""",Ahmad,,,
157,You are managing the changes made to the scope baseline. The causes of variances and the corrective action chosen should be included in: ,Recommended corrective action ,Scope management plan ,Risk Register ,Lessons learned register ,"The lessons learned register could be updated with techniques that are efficient and effective in controlling scope, including causes of variances and corrective actions chosen. [PMBOK 6th edition, Page 171] ",λΆ Ά§ο© ιΆδοο©Ά ιΆο Άκ ¤©›μ γιξ ¦α ι«« ιιλαη. ο¤  Άΰκολ «   ιε©νη νι¤© ιΆ­¥ο¥ο ικ¦Ά© εο:,ι¤©Ά ιΆ­¥ο¥ο΅ ικν­ξ  μ ,¦α΅ §©΅ ιλαη ,«¤ι ικ¦α© ,«¤ι ι§©ν« ικ«Άε§΅ ,"οκθλ Ά¥§ο£ «¤ι ι§©ν« ικ«Άε§΅  ιΆηλοΆ ιΆο ΆΆ«κ  ιθε΅ νιεγιο΅ εο ιΆ¥θκ εο ιλαη ?  κ εο ¨ιθ «   ιε©νη νι¤©Ά ιΆ­¥ο¥ο΅ ικ¦Ά©΅. [PMBOK ια γ΅ ι«§«΅ ? ι­ε¥΅ 171]",141,5,False,"""19""",Ahmad,,,
158,"A project is behind schedule and over budget. As a result of increased stakeholder pressure, the project team has been placed under serious pressure. This causes a conflict between the quality and production managers, with each blaming the other for the delay and cost overruns. What should the project manager do? ","Meet with both managers, and ask them to immediately end the conflict to avoid negatively impacting the project. ",Meet with the managers' supervisors to discuss possible actions. ,"Discuss the situation with the stakeholders, and follow their suggestions for dealing with the conflict. ",Refer to the team charter for guidelines on how to deal with this conflict. ,"The team charter is a document that establishes the team values, agreements, and operating guidelines for the team. The team charter include Conflict( resolution process. SO the project manager should Refer to the team charter for guidelines on how to deal with this conflict. [PMBOK 6th edition Page, 319]","ικ¬©νγ κΆ¦© γλ ι¤§νι ικλο νκΆ¤ν κολοΆμ. λΆο¤΅ ιο§΅ ΰδα ­¥  ικ­ι¥΅ ? Άγ©ΰ ε©οη ικ¬©νγ ιΰδνα ¬§ο§΅. ο›§ο μ¨ ιξ ¥§ν£ Άΰ©   ολ κ§ο©ο ι¤ν§΅ νιλΆ¤ ? ¥ο£ οινκ θι κλμκ ι™¦© γιξ ιΆ¦ο© νΆ¤ν ιΆθιοε. κ¨ ο¤  λ οεγι κ§ο© ικ¬©νγ?","η ι θι ικ§ο©ολ ? ναι  κλμκ λμ ιλγ γιξ ιεν© ιΆ¤λ  ιΆ£ο© «ι ρ γιξ ικ¬©νγ. ",η ι κ¬©εο ικ§ο©ολ ικλη¬΅ ι¤©Ά ικκθλ΅. ,"λη¬ ικνηε κγ ­¥  ικ­ι¥΅ ? νΆ γ ηΆ©¥Άμκ ιιΆγκι κγ ιλγ. ",©¤γ κο£η ιε©οη ιι¥­νι γιξ ©¬§Ά ¥νι θοεο΅ ιΆγκι κγ μ¨ ιΆγ©ΰ. ,"κο£η ιε©οη μν κ«Άλ§ ο¥§§ ηοκ ιε©οη νιΆεηοΆ ν©¬§Ά ιΆ¬δοι ιιε©οη. οΆΰκλ κο£η ιε©οη ιΆγ©ΰ (γκιο΅ ι¥ι. ι¨ ο¤  γιξ κ§ο© ικ¬©νγ ι©¤νγ ιξ κο£η ιε©οη ιι¥­νι γιξ ©¬§Ά ¥νι θοεο΅ ιΆγκι κγ μ¨ ιΆγ©ΰ. [PMBOK ια γ΅ ι«§«΅ ? ι­ε¥΅ 319]",145,4,False,"""16""",Ahmad,,,
159,"You are working with your team on estimating how much time each activity will take. One of the documents you are using contains information on categories of labor, material, and equipment required to complete your project. You are also interested to see skill levels of your labor, any certifications required, and grade levels your supplies. Which of the following documents would you primarily refer to for this purpose? ",Risk breakdown structure ,Organizational breakdown structure ,Work breakdown structure ,Resource breakdown structure ,"The project team is performing the Estimate Activity Durations process. An input to this process is the Resource Breakdown Structure (RBS) which is a hierarchical list of team and physical resources related by category and resource type that is used for planning, managing. and controlling project work. Each descending level represents an increasingly detailed description of the resource until the information is a small enough to be used in conjunction with the WBS to allow the work to be planned, monitored, and controlled. [PMBOK 6th edition, Page 198] ","λΆ Άγκι κγ ε©οηθ ιΆη§ο© ινηΆ ι¨ο «ο«Άδ©ημ θι λ¬α. Ά¥Άνο ¥§ξ ικ«Άλ§Ά ιΆο Ά«Ά¦§κμ γιξ κγινκΆ ¥νι εΆ ιγκι΅ νικν§ νικγ§Ά ικαιν ΅ ιθκι κ¬©νγθ. λΆ κμΆκ οΰρ  ©›ο΅ κ«ΆνοΆ κμ©΅ γκιθ ? νο ¬μ§Ά καιν ΅ ? νκ«ΆνοΆ §©¤Ά ικ§§Ά ι¦­΅  θ. ο κλ ικ«Άλ§Ά ιΆιο΅ η§ Ά¬ο© ιομ  ¬θι ««ο ιμ¨ ιδ©ΰ?",μοθι Άεθοθ ικ¦α© ,ιμοθι ιΆλβοκο ,λμο© ιμοθι ιγκι ,μοθι Άνογ ικν©§ ,"οηνκ ε©οη ικ¬©νγ  Άλεο¨ γκιο΅ Άη§ο© κ§§ ιλ¬α. ¥§ ικ§¦ιΆ εο μ¨μ ιγκιο΅ μν μοθι Άνογ ικν©§ (RBS) νμν γ ©΅ γλ ηκ΅ μ©κο΅ κλ ιε©οη νικν©§ ικ§ο΅ ικ©Ά α΅ ¥«  ιε΅ νλνγ ικν©§ ικ«Ά¦§κ΅ ιιΆ¦αοα νι§©΅. νιΆ¥θκ εο γκι ικ¬©νγ. οκ£ι θι κ«Άνξ Άλιο ν­ερ Άε­οιορ κΆο§ρ ιικν©§ ¥Άξ Ά­ ¥ ικγινκΆ ­δο©΅  κ οθεο ι«Ά¦§κμ κγ WBS ιι«κ¥  Ά¦αοα ιγκι νκ©η Άμ νιΆ¥θκ εομ. [PMBOK ια γ΅ ι«§«΅ ? ι­ε¥΅ 198]",142,3,False,"""18""",Ahmad,,,
160,Which of the following technique can be used to identify the key issues and suitable alternatives to be prioritized as a set of decisions for implementation? ,Requirements traceability matrix ,A responsibility assignment matrix (RAM) ,Stakeholder engagement assessment matrix ,Prioritization matrix ,"Prioritization matrix can be used to identify the key issues and suitable alternatives to be prioritized as a set of decisions for implementation. [PMBOK 6th edition, Page 283] ",ο κλ ι«ιο  ιΆιο΅ οκθλ «Ά¦§κμ ιΆ¥§ο§ ιηΰο ι©ο«ο΅ νι §ι ικλ« ΅ ιΆο ο¤  Ά¥§ο§ νινοΆμ θκ¤κνγ΅ κλ ιη©©Ά ιιΆλεο¨? ,κ­ενε΅ ΆΆ γ ικΆαι Ά ,κ­ενε΅ Ά¦­ο­ ικ«›νιο΅ (RAM) ,κ­ενε΅ Άηοοκ κ¬©θ΅ ­¥  ικ­ι¥΅ ,κ­ενε΅ Ά¥§ο§ ινινοΆ ,"οκθλ «Ά¦§κ κ­ενε΅ Ά¥§ο§ ινινοΆ ιΆ¥§ο§ ιηΰο ι©ο«ο΅ νι §ι ικλ« ΅ ιΆο ο¤  Ά©Άο μ ¥«  ινινο΅ θκ¤κνγ΅ κλ ιη©©Ά ιιΆλεο¨. [PMBOK ια γ΅ ι«§«΅ ? ι­ε¥΅ 283]",144,3,False,"""19""",Ahmad,,,
161,A project manager is currently developing the project schedule for a mandatory regulatory project. The project manager is receiving input from different stakeholders and finds that many of them are estimating completion times that are longer than the established end date. What should the project manager do next? ,Apply crashing to the project management plan in order to reduce the extension of the proposed schedule. ,Remind the stakeholders about the project constraints and request a revision of their inputs. ,Identify a new critical path that could guarantee the project's completion by the end date. ,Notify the sponsor and request to modify the end date to accommodate the proposed schedule. ,"Since the stakeholders inputs will impact the established end date, the project manager should FIRST Notify the sponsor and request to modify the end date to accommodate the proposed schedule. The option (Remind the stakeholders about the project constraints and request a revision of their inputs) may be the next step if the project sponsor refuse to modify the end date. [PMBOK 6th edition, Page 205] ",οηνκ κ§ο© ικ¬©νγ ¥ιορ  Άανο© ¤§νι ικ¬©νγ ικ¬©νγ Άλβοκο ικο. οΆιηξ κ§ο© ικ¬©νγ κ§¦ιΆ κλ κ¦Άιε ­¥  ικ­ι¥΅ νο¤§ λ ιγ§ο§ κλμκ οη§©νλ νηΆ ιλ¤ ιΆο Άθνλ ανι κλ Ά©ο¦ ιλΆμ ικ¥§§. κ¨ ο¤  λ οεγι κ§ο© ικ¬©νγ  γ§ ¨ιθ?,Άα οη ¥¬§ ικν©§ γιξ ¦α΅ §©΅ ικ¬©νγ κλ ¤ι Άηιοι Άκ§ο§ ι¤§νι ικλο ικηΆ©¥. ,¨θ© ­¥  ικ­ι¥΅ ¥νι ηον§ ικ¬©νγ ναι  κ©¤γ΅ κ§¦ιΆμκ. ,¥§§ κ«©ρ ¥©¤ρ ¤§ο§ρ οκθλ λ οΰκλ θΆκι ικ¬©νγ  ¥ινι Ά©ο¦ ιλΆμ. ,ηκ  ¦α© ι©γο ναι  Άγ§οι Ά©ο¦ ιλΆμ ικικ΅ ι¤§νι ικλο ικηΆ©¥. ,"λβ©ρ ιλ κ§¦ιΆ ­¥  ικ­ι¥΅ «Ά›£© γιξ Ά©ο¦ ιλΆμ ικ¥§§ ? ο¤  γιξ κ§ο© ικ¬©νγ νιρ ¦α© ι©γο ναι  Άγ§οι Ά©ο¦ ιλΆμ ι«Άογ  ι¤§νι ικλο ικηΆ©¥. η§ οθνλ ι¦ο© (Ά¨θο© ­¥  ικ­ι¥΅  ¬λ ηον§ ικ¬©νγ ναι  κ©¤γ΅ κ§¦ιΆμκ) μν ι¦αν΅ ιΆιο΅ ¨ ©εΰ ©γο ικ¬©νγ Άγ§οι Ά©ο¦ ιλΆμ. [PMBOK ια γ΅ ι«§«΅ ? ι­ε¥΅ 205]",142,3,False,"""19""",Ahmad,,,
162,"During the development of the scope management plan, a stakeholder requests the addition of pilot technology into the project scope to assist with the product marketing. What should the project manager do? ",Use the project reserve for the pilot technology. ,Review the scope baseline with the stakeholder. ,Increase the project budget with the cost of the pilot technology. ,Include the stakeholder in the scope planning meetings. ,"The project manager should Include the stakeholder in the scope planning meetings. Note that meeting is one of the tools and techniques in the Plan Scope Management process to develop the Scope Management Plan. [PMBOK 6th edition Page, 136]","£λ Άανο© ¦α΅ §©΅ ιλαη ? οαι  ¥§ ­¥  ικ­ι¥΅ ΰε΅ Άηλο΅ Ά¤©ο ο΅ ιξ λαη ικ¬©νγ ιικ«γ§΅ εο Ά«νοη ικλΆ¤. κ¨ ο¤  λ οεγι κ§ο© ικ¬©νγ?",«Ά¦§κ ¥Άοαο ικ¬©νγ ιιΆθλνιν¤ο ιΆ¤©ο ο΅. ,©¤γ ¦α ι«« ιιλαη κγ ­¥  ικ­ι¥΅. ,ο§΅ κολο΅ ικ¬©νγ  Άθιε΅ ιΆθλνιν¤ο ιΆ¤©ο ο΅. ,Άΰκολ ­¥  ικ­ι¥΅ εο  ¤ΆκγΆ Ά¦αοα ιλαη. ,"ο¤  γιξ κ§ο© ικ¬©νγ Άΰκολ ­¥  ικ­ι¥΅ εο ¤ΆκγΆ Ά¦αοα ιλαη. ι¥β λ ι¤Άκγ μν ¥§ ι§νΆ νιΆηλοΆ εο γκιο΅ §©΅ λαη ι¦α΅ ιΆανο© ¦α΅ §©΅ ιλαη. [PMBOK ια γ΅ ι«§«΅ ? ι­ε¥΅ 136]",141,3,False,"""20""",Ahmad,,,
163,"You are the project manager of a Construction project. The project sponsor has information about the project which is behind schedule and over budget, but he wants more details about the progress of the project. As a project manager, what should you provide to the project sponsor about the status of the project? ",Work performance information ,Work performance data ,Earned value report ,Work performance report ,"Sponsor know that the project are behind schedule and over budget, so he knows Earned Value report, in this case the project manager should provide the sponsor with (Work performance report) because it includes status reports and progress reports. [PMBOK 6th edition, Page 382] ","λΆ κ§ο© κ¬©νγ  λ. ι§ξ ©γο ικ¬©νγ κγινκΆ ¥νι ικ¬©νγ ικΆ¦© γλ ι¤§νι ικλο νικΆ¦αο ικολο΅ ? ιθλμ ο©ο§ κο§ρ κλ ιΆε­οι ¥νι Άη§κ ικ¬©νγ.  ­εΆθ κ§ο© κ¬©νγ ? κ ι¨ο ο¤  λ Άη§κμ ι©γο ικ¬©νγ ¥νι ¥ι΅ ικ¬©νγ?",κγινκΆ § ιγκι , ολΆ § ιγκι ,Άη©ο© ιηοκ΅ ικθΆ« ΅ ,Άη©ο© § ιγκι ,"ογ©ε ι©γο λ ικ¬©νγ κΆ¦© γλ ι¤§νι ικλο νκΆ¦αο κολοΆμ ? ι¨ιθ εμν ογ©ε Άη©ο© ιηοκ΅ ικθΆ« ΅ ? νεο μ¨μ ι¥ι΅ ο¤  γιξ κ§ο© ικ¬©νγ Άνο§ ι©γο  • (Άη©ο© § ιγκι) ιλμ οΆΰκλ Άη©ο© ι¥ι΅ νΆη©ο© ιΆη§κ. [PMBOK ια γ΅ ι«§«΅ ? ι­ε¥΅ 382]",146,4,False,"""20""",Ahmad,,,
164,"A project's primary focus is on schedule. To monitor this, the project manager requests monthly progress reports from the contractor. What should the project manager ask the contractor to include in these reports? ",Schedule attributes. ,Work breakdown structure (WBS) ,Network chart. ,Gantt chart. ,"The project manager should ask the contractor to include Gantt charts or also known as Bar charts in these reports because its represent schedule information where activities are listed on the vertical axis, dates are shown on the horizontal axis, and activity durations are shown as horizontal bars placed according to start and finish dates. Gantt or Bar charts are relatively easy to read and are commonly used. [PMBOK 6th edition Page, 217]","ολ­  ιΆ©θο ι««ο ιικ¬©νγ γιξ ι¤§νι ικλο. ικ©η ΅ ¨ιθ ? οαι  κ§ο© ικ¬©νγ Άη©ο© κ©¥ιο΅ ¬μ©ο΅ κλ ικηνι. κ ι¨ο ο¤  λ οαι  κ§ο© ικ¬©νγ κλ ικηνι Άΰκολμ εο μ¨μ ιΆη©ο©?",«κΆ ι¤§νι. ,μοθι Άλβοκ ιγκι (WBS) ,κ¦αα ι¬ θ΅. ,κ¦αα ¤λΆ. ,"ο¤  λ οαι  κ§ο© ικ¬©νγ κλ ικηνι Άΰκολ κ¦ααΆ ¤λΆ ν ικγ©νε οΰρ  «κ ικ¦ααΆ ι¬©οαο΅ εο μ¨μ ιΆη©ο© ιλμ Άκ£ι κγινκΆ ι¤§νι ικλο ¥ο£ οΆκ «©§ ιλ¬α΅ γιξ ικ¥ν© ι©«ο ? νΆβμ© ιΆν©ο¦ γιξ ικ¥ν© ιεηο ? νοΆκ γ©ΰ εΆ©Ά ιλ¬α θ¬©α΅ εηο΅ οΆκ νΰγμ νεηρ ιΆν©ο¦ ι § νιλΆμ. κλ ι«μι λ« ορ η©΅ ικ¦ααΆ ι¬©οαο΅ ν κ¦ααΆ ¤λΆ ν¬γ΅ ι«Ά¦§κ. [PMBOK ια γ΅ ι«§«΅ ? ι­ε¥΅ 217]",142,5,False,"""20""",Ahmad,,,
